TITLE,DESCRIPTION,PRICE,CURRENCY_CODE,QUANTITY,TAGS,MATERIALS,IMAGE1,IMAGE2,IMAGE3,IMAGE4,IMAGE5,IMAGE6,IMAGE7,IMAGE8,IMAGE9,IMAGE10,"VARIATION 1 TYPE","VARIATION 1 NAME","VARIATION 1 VALUES","VARIATION 2 TYPE","VARIATION 2 NAME","VARIATION 2 VALUES",SKU
"Funny Silkscreen Poster - The Early Bird Gets the Worm, The Early Worm Gets Eaten","Some days are optimistic, some days are not – this is the poster for both. Second poster in a 3-part Susie Sunshine/Debbie Downer series.

12 1/2x19” poster. Each is hand-printed, 4-process print in orange, blue, grey, and black ink on 100 lb. Starch White Speckletone stock from French Paper Co. Each print is individually pulled by hand, numbered and signed, and will contain unique imperfections.",35,USD,3,"sarcastic,advice,funny,humor,simple,optimist,pessimist,handprint,silkscreen","French Paper Co,acrylic ink,orange,blue,grey,black",https://i.etsystatic.com/6311609/r/il/a538dc/3204551021/il_fullxfull.3204551021_7849.jpg,https://i.etsystatic.com/6311609/r/il/87ca6c/3204551129/il_fullxfull.3204551129_c1do.jpg,https://i.etsystatic.com/6311609/r/il/ea8be6/3204551177/il_fullxfull.3204551177_1x8e.jpg,https://i.etsystatic.com/6311609/r/il/97795a/3156842270/il_fullxfull.3156842270_amhx.jpg,,,,,,,,,,,,,
"3x3"" Sticker 4-Pack","Mix and match any 4 stickers for your 4-pack. Please lis which ones you would like as a message in your purchase. Stickers are 3x3"" on quality vinyl.

- Benson and Hedgehog Christmas
- Shit Could Be Worse
- GTFO (4x4"")
- Drinks Like a Sailor Swears Like a Fish
- Benson and Hedgehog Balloon
- Space Hedgehog
- It's An Honor Just To Be Asian
- Spooky Scary",10,USD,9,"Stickers,Cute,Fun,Animals,Sayings,Quotes,Halloween,Kids",,https://i.etsystatic.com/6311609/r/il/b38091/4257386058/il_fullxfull.4257386058_cvo5.jpg,https://i.etsystatic.com/6311609/r/il/3cbcb5/4341244200/il_fullxfull.4341244200_hlnh.jpg,https://i.etsystatic.com/6311609/r/il/d787fc/4304782273/il_fullxfull.4304782273_152l.jpg,https://i.etsystatic.com/6311609/r/il/1dd6c4/4304782263/il_fullxfull.4304782263_rzxd.jpg,https://i.etsystatic.com/6311609/r/il/c4bc2d/4257386038/il_fullxfull.4257386038_5iqx.jpg,https://i.etsystatic.com/6311609/r/il/ce8346/4257386010/il_fullxfull.4257386010_i2yc.jpg,https://i.etsystatic.com/6311609/r/il/57cc89/4304782229/il_fullxfull.4304782229_nl0m.jpg,https://i.etsystatic.com/6311609/r/il/74d84a/4257386110/il_fullxfull.4257386110_j16a.jpg,https://i.etsystatic.com/6311609/r/il/206405/4257386116/il_fullxfull.4257386116_p4nr.jpg,,,,,,,,
"Benson & Hedgehog Enamel Camp Cup","Benson and Hedgehog are the perfect pair for your next camping adventure. This enamel mug is 12oz. and dishwasher safe with a black rim for a unique look. Material: cold-rolled steel plate, with enamel glazed surface One size: 12oz (0.35 l) Glossy finish Dishwasher safe",16,USD,998,,,https://i.etsystatic.com/6311609/r/il/e1f11a/4505302188/il_fullxfull.4505302188_nl1f.jpg,https://i.etsystatic.com/6311609/r/il/c7d36b/4552669725/il_fullxfull.4552669725_tvxv.jpg,https://i.etsystatic.com/6311609/r/il/946c8e/4505302488/il_fullxfull.4505302488_7ogl.jpg,https://i.etsystatic.com/6311609/r/il/9749eb/4505302594/il_fullxfull.4505302594_pub4.jpg,https://i.etsystatic.com/6311609/r/il/f9376e/4552670041/il_fullxfull.4552670041_4753.jpg,,,,,,,,,,,,30097507076413769048
"I'll Be Nicer If You'll Be Smarter Enamel Camp Cup","Wise words with a warm cup of coffee. This enamel mug is 12oz. and dishwasher safe with a black rim for a unique look. Material: cold-rolled steel plate, with enamel glazed surface One size: 12oz (0.35 l) Glossy finish Dishwasher safe",16,USD,998,,,https://i.etsystatic.com/6311609/r/il/6b8290/4505302816/il_fullxfull.4505302816_isz5.jpg,https://i.etsystatic.com/6311609/r/il/40a8c8/4505302874/il_fullxfull.4505302874_q3nt.jpg,https://i.etsystatic.com/6311609/r/il/4020bd/4552670313/il_fullxfull.4552670313_mr1z.jpg,https://i.etsystatic.com/6311609/r/il/c57680/4505303082/il_fullxfull.4505303082_9924.jpg,https://i.etsystatic.com/6311609/r/il/5bc9e3/4552670479/il_fullxfull.4552670479_8d5n.jpg,,,,,,,,,,,,22157129927767605534
"If You Can't Say Anything Nice Say Something Sarcastic Mug 11oz","A fun hand-lettered twist to a common saying. Never run out of your favorite hot drink! Durable white ceramic mug in the most popular size.

• Black ceramic
• 11 oz (0.33 l)
• C-handle
• Dishwasher safe",11.9,USD,995,"funny,sarcastic,saying,quote",Ceramic,https://i.etsystatic.com/6311609/r/il/5bb412/2699501558/il_fullxfull.2699501558_ttwu.jpg,https://i.etsystatic.com/6311609/r/il/4ed249/2747179415/il_fullxfull.2747179415_kjtv.jpg,https://i.etsystatic.com/6311609/r/il/ad0957/2747179483/il_fullxfull.2747179483_1v1z.jpg,https://i.etsystatic.com/6311609/r/il/a56cea/2747179589/il_fullxfull.2747179589_8cpm.jpg,https://i.etsystatic.com/6311609/r/il/519427/2747179691/il_fullxfull.2747179691_gj83.jpg,https://i.etsystatic.com/6311609/r/il/14e8b4/2747179861/il_fullxfull.2747179861_55cm.jpg,,,,,"Custom Property",Sizes,11oz,,,,1968305422
"Drinks Like a Sailor, Swears Like a Fish Enamel Camp Cup","Whether it's whiskey or coffee, this mug is ready for your next camping (or sailing) adventure. This enamel mug is 12oz. and dishwasher safe with a black rim for a unique look. Material: cold-rolled steel plate, with enamel glazed surface One size: 12oz (0.35 l) Glossy finish Dishwasher safe",16,USD,999,,,https://i.etsystatic.com/6311609/r/il/daf96e/4552671035/il_fullxfull.4552671035_c4ly.jpg,https://i.etsystatic.com/6311609/r/il/38bed6/4552671113/il_fullxfull.4552671113_cnwe.jpg,https://i.etsystatic.com/6311609/r/il/57e7e5/4552671191/il_fullxfull.4552671191_rkdj.jpg,https://i.etsystatic.com/6311609/r/il/2b5bdb/4552671301/il_fullxfull.4552671301_7ocu.jpg,https://i.etsystatic.com/6311609/r/il/30cb02/4552671395/il_fullxfull.4552671395_srjt.jpg,,,,,,,,,,,,19855696503952729172
"Funny Hang Tags - You're Welcome, Linoleum Block Gift Tags (5-pack)","Gift tags for presents so awesome you can skip the Thank You card.

3 3/4x1 7/8” manila shipping tags with hand-stamped “You’re Welcome”. Tags are hand-pressed, single process linoleum block print on 13 point cardstock with brown, reinforced circle. Each tag includes a red & white baker's twine loop, is individually pressed by hand and will contain some unique imperfections.

Please contact me for larger orders.",4,USD,9,"Gift_Tag,funny,sarcastic,gift,typography,stamp,lino_block,hand_print,black,shipping_tag,manila,tag,simple","manila gift tag,shipping tag,waxed twine,black ink",https://i.etsystatic.com/6311609/r/il/ef8644/1461242621/il_fullxfull.1461242621_a71v.jpg,https://i.etsystatic.com/6311609/r/il/91d526/438795874/il_fullxfull.438795874_pgcz.jpg,https://i.etsystatic.com/6311609/r/il/710a52/438807933/il_fullxfull.438807933_6l1b.jpg,,,,,,,,,,,,,,
"Simple Linoleum Print Poster - Letter A","9x9"" poster with hand-drawn/hand cut letter A. 

Poster is hand cut single-process linoleum block print in teal ink on 100 lb. Speckletone cover stock from French Paper Co. Each print is individually pressed by hand and signed, and will contain some unique imperfections.",10,USD,10,"Typography,Handmade,Hand_drawn,Linocut,Design,Bold,A,Alphabet,letter,banner,handlettered,nautical",,https://i.etsystatic.com/6311609/r/il/b61982/3204552741/il_fullxfull.3204552741_9oz5.jpg,https://i.etsystatic.com/6311609/r/il/06f5ab/3156843870/il_fullxfull.3156843870_5onn.jpg,https://i.etsystatic.com/6311609/r/il/47e112/3204552839/il_fullxfull.3204552839_r1vk.jpg,,,,,,,,,,,,,,
"Bright Greeting Card - Oh Hello, Silkscreen Card w/envelope","6x4” folded Oh Hello card with 100% recycled paper envelope. Card is a 2-process silkscreen print in hand-mixed yellow and blue on 140 lb. Muscletone cardstock from French Paper Co. Inside is blank. Each print is individually pulled by hand and will contain some unique imperfections. 

Please contact me for larger orders.",5,USD,10,"6x4,hello,yellow,blue,bright,happy,thinking_of_you,silkscreen,hand_print,typography,cheery,stripes,sprint","French Paper Company,recycled envelope,blue ink,yellow ink",https://i.etsystatic.com/6311609/r/il/cb29ff/438794202/il_fullxfull.438794202_hszw.jpg,https://i.etsystatic.com/6311609/r/il/199bea/438794200/il_fullxfull.438794200_5xzr.jpg,,,,,,,,,,,,,,,
"Funny Silkscreen Poster - What Doesn't Kill You Makes You Stronger, What Does Kill You Makes You Dead","Some days are optimistic, some days are not – this is the poster for both. First poster in a 3-part Susie Sunshine/Debbie Downer series. 

12 1/2x19” poster. Each is hand-printed, 3-process print in orange, blue, and black ink on 100 lb. Starch White Speckletone stock from French Paper Co. Each print is individually pulled by hand, numbered and signed, and will contain unique imperfections. Initial run of 10 prints.",30,USD,2,"Poster,Print,silkscreen,funny,sarcastic,advice,art,handprint,optimistic,pessimistic,simple","blue ink,orange ink,black ink,French Paper Co",https://i.etsystatic.com/6311609/r/il/8f2dfa/3156845046/il_fullxfull.3156845046_ktzu.jpg,https://i.etsystatic.com/6311609/r/il/cd6a35/3156845176/il_fullxfull.3156845176_3ev9.jpg,https://i.etsystatic.com/6311609/r/il/4813b8/3204554097/il_fullxfull.3204554097_pdm3.jpg,https://i.etsystatic.com/6311609/r/il/016b77/3156845262/il_fullxfull.3156845262_lujo.jpg,,,,,,,,,,,,,
"Simple Greeting Card - Bluebirds, Silkscreen Card w/envelope","Great springtime card for Mother's Day, Father's day or just to say hi.

4x6” folded bluebirds card with 100% recycled paper envelope. Card is a 2-process silkscreen print in hand-mixed blue and black ink on 140 lb. Muscletone cardstock from French Paper Co. Inside is blank. Each print is individually pulled by hand and will contain some unique imperfections. Colors may vary.

Please contact me for larger orders.",5,USD,20,"silkscreen,2_tone,spring,birds,mothers_day,fathers_day,bluebird,black,twig,handprint,blank","French Paper Compant,blue ink,black ink,recycled envelope",https://i.etsystatic.com/6311609/r/il/806137/438808783/il_fullxfull.438808783_i95i.jpg,https://i.etsystatic.com/6311609/r/il/f1bcfd/438796706/il_fullxfull.438796706_d77y.jpg,https://i.etsystatic.com/6311609/r/il/4cd861/438796718/il_fullxfull.438796718_aes4.jpg,,,,,,,,,,,,,,
"Funny Birthday Card (Belated), Linoleum Block Print w/envelope","4x6"" folded belated birthday card that reads ""Better late than never, Happy Birthday"". 

Card is a 2-process linoleum block print on 140 lb. Muscletone cover stock from French Paper Co. Printed in black and red. 

Inside is blank. 

Each print is individually pressed by hand and will contain some unique imperfections.",5,USD,10,"Birthday,Belated,Happy,Block_Print,Handprint,Black,Red,Ribbon,Happy_Birthday,Funny",,https://i.etsystatic.com/6311609/r/il/d52416/743089808/il_fullxfull.743089808_psk5.jpg,https://i.etsystatic.com/6311609/r/il/fe40b0/743089652/il_fullxfull.743089652_oxwv.jpg,https://i.etsystatic.com/6311609/r/il/f0afd5/743214031/il_fullxfull.743214031_khuo.jpg,,,,,,,,,,,,,,
"Simple Linoleum Print Poster - Letter B","9x9"" poster with hand-drawn/hand cut letter B. 

Poster is hand cut single-process linoleum block print in blue ink on 100 lb. Speckletone cover stock from French Paper Co. Each print is individually pressed by hand and signed, and will contain some unique imperfections.",10,USD,13,"B,Typography,Handmade,Hand_drawn,Linocut,Design,Bold,Alphabet,Lettering,Handlettered,Handlettering,Blue,Swash",,https://i.etsystatic.com/6311609/r/il/1d62a8/3156849752/il_fullxfull.3156849752_rpag.jpg,https://i.etsystatic.com/6311609/r/il/15061d/3204558819/il_fullxfull.3204558819_s1zx.jpg,https://i.etsystatic.com/6311609/r/il/4dc394/3204558867/il_fullxfull.3204558867_5zlm.jpg,,,,,,,,,,,,,,
"Drinks Like a Sailor Swears Like a Fish Mug 11oz","A fun hand-lettered twist on some common sayings. Never run out of your favorite hot drink! Durable white ceramic mug in the most popular size.

• Black ceramic
• 11 oz (0.33 l)
• C-handle
• Dishwasher safe",11.9,USD,997,"mug,funny,saying,quote,nautical",,https://i.etsystatic.com/6311609/r/il/b757fe/2711610151/il_fullxfull.2711610151_6hcd.jpg,https://i.etsystatic.com/6311609/r/il/1af30e/2663933502/il_fullxfull.2663933502_th8z.jpg,https://i.etsystatic.com/6311609/r/il/5b95ed/2663933554/il_fullxfull.2663933554_osrq.jpg,https://i.etsystatic.com/6311609/r/il/cad6c6/2663961866/il_fullxfull.2663961866_mum1.jpg,,,,,,,"Custom Property",Sizes,11oz,,,,1846895500
"Simple State Silkscreen Poster - The North Star State","Inspired by my home state - this 11x14"" poster is a hand lettered, hand cut and hand pulled labor of love. 

Poster is printed in gold ink on black (80lb.) and white (100lb.) smooth coverstock. Each print is individually pulled by hand and signed, and will contain some unique imperfections. 

Looks great at home or in the office, framed on unframed.",20,USD,14,"gold,minnesota,black,white,north_star,star,state,handlettering,print,handprint,midwest,typography,handlettered",,https://i.etsystatic.com/6311609/r/il/cee78e/3204560789/il_fullxfull.3204560789_r7eq.jpg,https://i.etsystatic.com/6311609/r/il/e44b80/3204560925/il_fullxfull.3204560925_9xtd.jpg,https://i.etsystatic.com/6311609/r/il/c7089d/3156851868/il_fullxfull.3156851868_dshi.jpg,https://i.etsystatic.com/6311609/r/il/e58de3/3156851930/il_fullxfull.3156851930_48i8.jpg,https://i.etsystatic.com/6311609/r/il/7b3cec/3204561063/il_fullxfull.3204561063_qa8w.jpg,https://i.etsystatic.com/6311609/r/il/e0edf7/3156852026/il_fullxfull.3156852026_7zsz.jpg,,,,,Color,"Primary color","White,Black",,,,
"Funny Silkscreen Poster - Types of Burrito Eaters","12x18"" poster featuring types of burrito eaters by method. All icons were hand drawn then finished digitally.

Poster is hand cut single-process silkscreen print in black ink on 100 lb. Speckletone cover stock from French Paper Co. Each of the prints is individually pulled by hand, numbered and signed, and will contain some unique imperfections.

Looks great at home or in the office, framed on unframed.",25,USD,14,"food,burritos,poster,silkscreen,handprinted,black,gift,sarcastic,funny,print,icons,illustration,iconography",,https://i.etsystatic.com/6311609/r/il/28f95b/3156836486/il_fullxfull.3156836486_r0je.jpg,https://i.etsystatic.com/6311609/r/il/4cbbb2/3149086564/il_fullxfull.3149086564_axm1.jpg,https://i.etsystatic.com/6311609/r/il/aba15f/3196798737/il_fullxfull.3196798737_gygs.jpg,https://i.etsystatic.com/6311609/r/il/33ace1/3149086626/il_fullxfull.3149086626_cp28.jpg,,,,,,,,,,,,,
"Funny Silkscreen Poster - I'll Be Nicer If You'll Be Smarter","11x15"" poster. Poster is printed in black and teal ink on 80 lb. smooth coverstock. Each print is individually pulled by hand, numbered and signed, and will contain some unique imperfections. 

Looks great at home or in the office, framed on unframed.",20,USD,17,"art,screenprint,poster,black,teal,coverstock,funny,sarcastic,ribbon,typography,gift,advice,inspirational","80lb coverstock,Teal Ink,Black Ink",https://i.etsystatic.com/6311609/r/il/c0f19e/3204562573/il_fullxfull.3204562573_9dek.jpg,https://i.etsystatic.com/6311609/r/il/5dff0a/3156853514/il_fullxfull.3156853514_s51t.jpg,https://i.etsystatic.com/6311609/r/il/d969b9/3156853538/il_fullxfull.3156853538_cvxi.jpg,https://i.etsystatic.com/6311609/r/il/f721e3/3204562697/il_fullxfull.3204562697_fji5.jpg,,,,,,,,,,,,,
"Retro Thank You Card, Linoleum Block Print w/envelope","4x6” folded Thank You Card with 100% recycled paper envelope. This retro style card is a single process linoleum block print in orange on 140 lb. Muscletone cardstock from French Paper Co. Inside is blank. Each print is individually pressed by hand and will contain some unique imperfections. 

Please contact me for larger orders.",4,USD,8,"orange,card,4x6,thank_you,thanks,recycled_envelope,print,1950s,folded_card,hand_print,linoleum_block,typography,vintage_look","recycle envelope,140 lb muscletone paper,french paper co,grocery bag,orange ink",https://i.etsystatic.com/6311609/r/il/864c3b/438791502/il_fullxfull.438791502_30fj.jpg,https://i.etsystatic.com/6311609/r/il/a90db2/438791500/il_fullxfull.438791500_trga.jpg,,,,,,,,,,,,,,,
"Simple Folded Card - XO, Linoleum Block Print w/envelope","4x6"" folded XO card with envelope. Cards are hand-printed 2-process linoleum block prints in red and white on 140 lb. Muscletone cover stock from French Paper Co. Block is hand carved. Inside is blank. Each print is individually pressed by hand and will contain some unique imperfections.

Great for anniversaries, love notes, or just to tell someone hello!

This card was featured on Design Sponge* http://www.designsponge.com/2012/01/est-1986-valentines-day-cards.html

Please contact me for larger orders.",4,USD,5,"Red,Simple,Typography,XO,Cards,Paper_Goods,Linoleum_Print,Hand_Print,Love,Thinking_of_you,Folded_card,Mothers_Day,Valentine","Cover Stock,Linoleum Block,French Paper Co,Red,White",https://i.etsystatic.com/6311609/r/il/a16c9b/438805209/il_fullxfull.438805209_e5kk.jpg,https://i.etsystatic.com/6311609/r/il/f96ffa/438793242/il_fullxfull.438793242_hk6g.jpg,https://i.etsystatic.com/6311609/r/il/eaa21e/301213031/il_fullxfull.301213031.jpg,https://i.etsystatic.com/6311609/r/il/2ef837/301213193/il_fullxfull.301213193.jpg,,,,,,,,,,,,,
"Simple Linoleum Print Poster - Letter C","9x9"" poster with hand-drawn/hand cut letter C. 

Poster is hand cut single-process linoleum block print in teal ink on 100 lb. Speckletone cover stock from French Paper Co. Each print is individually pressed by hand and signed, and will contain some unique imperfections.",10,USD,4,"typography,handmade,hand_drawn,letter,alphabet,c,linocut,handlettered,stripes",,https://i.etsystatic.com/6311609/r/il/0d8fa8/3204567623/il_fullxfull.3204567623_7vv7.jpg,https://i.etsystatic.com/6311609/r/il/0d8204/3204567769/il_fullxfull.3204567769_n77e.jpg,https://i.etsystatic.com/6311609/r/il/097812/3204567861/il_fullxfull.3204567861_gxp8.jpg,,,,,,,,,,,,,,
"Shit Could Be Worse Enamel Camp Cup","Shit could be worse, but at least you're camping. This enamel mug is 12oz. and dishwasher safe with a black rim for a unique look.
Material: cold-rolled steel plate, with enamel glazed surface
One size: 12oz (0.35 l)
Glossy finish
Dishwasher safe",16,USD,999,,,https://i.etsystatic.com/6311609/r/il/e0233a/4364118762/il_fullxfull.4364118762_mc5i.jpg,https://i.etsystatic.com/6311609/r/il/b0e966/4411503907/il_fullxfull.4411503907_91hd.jpg,https://i.etsystatic.com/6311609/r/il/94afb0/4411503989/il_fullxfull.4411503989_18ur.jpg,https://i.etsystatic.com/6311609/r/il/d08d39/4411504073/il_fullxfull.4411504073_61ao.jpg,https://i.etsystatic.com/6311609/r/il/5b5e9a/4411504157/il_fullxfull.4411504157_o818.jpg,,,,,,,,,,,,14255014372806520432
"Benson & Hedgehog Christmas Cards (1, 10, 30, and 50pcs)","A Benson and Hedgehog holiday! 4.25x5.5 folded matte finish greeting cards with your two favorite pals. 

Available in 1, 10, 30, and 50 pcs for you to find the best match for your needs. All cards come with envelopes. 
Material: 270gsm paper
Envelopes included
Sustainable paper from FSC® and SFI® certified facilities",5.33,USD,3996,,,https://i.etsystatic.com/6311609/r/il/962865/4364012370/il_fullxfull.4364012370_c4gg.jpg,https://i.etsystatic.com/6311609/r/il/aa9136/4364012816/il_fullxfull.4364012816_e8u2.jpg,https://i.etsystatic.com/6311609/r/il/5e1707/4411397493/il_fullxfull.4411397493_rjf8.jpg,https://i.etsystatic.com/6311609/r/il/fed071/4364012736/il_fullxfull.4364012736_nim5.jpg,,,,,,,"Custom Property",Quantity,"1 pc,10 pcs,30 pcs,50 pcs",,,,"99487353460801428684,74714159423914628434,23965441006250488443,22324887584366817917"
"Funny Silkscreen Poster - The Possibilities Are Endless* Some Restrictions May Apply","11x14"" poster. Poster is hand cut 2-process screenprint on 80lb. or 100lb. coverstock with a slight texture. Each print was individually pulled by hand and signed, and will contain some unique imperfections. 

Variations:
White with black and neon yellow ink
Black with white and neon yellow ink (ink comes thru slightly greener on black)

Looks great at home or in an office, framed or unframed.",25,USD,4,"hand_printed,poster,fun,neon,funny,asterisk",,https://i.etsystatic.com/6311609/r/il/23e85d/3156864290/il_fullxfull.3156864290_2dw6.jpg,https://i.etsystatic.com/6311609/r/il/3606b3/3204573627/il_fullxfull.3204573627_k43p.jpg,https://i.etsystatic.com/6311609/r/il/9dfa8d/3156864444/il_fullxfull.3156864444_jvl4.jpg,https://i.etsystatic.com/6311609/r/il/2e8966/3204573767/il_fullxfull.3204573767_qkjx.jpg,https://i.etsystatic.com/6311609/r/il/440073/3156864526/il_fullxfull.3156864526_aesl.jpg,https://i.etsystatic.com/6311609/r/il/f3e517/3156864584/il_fullxfull.3156864584_8btp.jpg,,,,,Material,Material,"White 100lb. Paper,Black 80lb. Paper",,,,
"Funny Linoleum Print Poster - Sh*t Could Be Worse","Original Shit Could Be Worse 11x14"" poster inspired by the only advice my friend would give me on a bad day. 

Poster is hand cut single-process linoleum block print in black ink on 100 lb. Speckletone cover stock from French Paper Co. Each print is individually pressed by hand, numbered and signed, and will contain some unique imperfections.

Looks great at home or in the office, framed on unframed.",20,USD,1,"Funny,Poster,Minimalist,Simple,Sarcastic,Advice,Hand_Printed,Linoleum_print,Typography,Mature,Shit_Could_Be_Worse,inspirational,quote","100 lb cover stock,black ink,linoleum block,cover stock",https://i.etsystatic.com/6311609/r/il/2d67c0/438803063/il_fullxfull.438803063_7ayo.jpg,https://i.etsystatic.com/6311609/r/il/990741/3204580309/il_fullxfull.3204580309_2i2c.jpg,https://i.etsystatic.com/6311609/r/il/63ec7f/3156871172/il_fullxfull.3156871172_nll0.jpg,https://i.etsystatic.com/6311609/r/il/83aa51/3156871222/il_fullxfull.3156871222_rxnl.jpg,,,,,,,,,,,,,
"Happy Holidays Card (4x6"") & Envelope","4x6"" Happy F*cking Holidays card. 2-tone linoleum block process on 140lb Muscletone cover stock from French Paper Co. Printed in blue and white. Hand carved type and small snowflake detail. Inside is blank. Each print is individually pressed by hand and will contain some unique imperfections.

Envelope included.",4,USD,2,"paper_goods,cards,christmas,hanukkah,Holiday,snowflake,happy_holidays,linoleum_block,linoleum_print,print,lino_print,lino_block","coverstock,cover stock,french paper co,linoleum block",https://i.etsystatic.com/6311609/r/il/8c1bd4/514905116/il_fullxfull.514905116_pcq2.jpg,https://i.etsystatic.com/6311609/r/il/6f17f3/514968869/il_fullxfull.514968869_po94.jpg,,,,,,,,,,,,,,,
"Holiday Card - Very Merry Something (5-pack)","Somewhat non-denominational, postcard-style holiday card. Offset printed on 14lb cover stock in burnt red and blue with a small snowflake. Available in packs of five cards. Envelopes included.

If you would like to order a larger amount, or with envelopes, please contact me directly and I will create a listing for you.",10,USD,21,"card,postcard,holiday,hanukkah,christmas,winter,red,blue,4x6,merry","14lb cover stock",https://i.etsystatic.com/6311609/r/il/cafb5d/514903612/il_fullxfull.514903612_4nqg.jpg,https://i.etsystatic.com/6311609/r/il/f56567/514903610/il_fullxfull.514903610_o4on.jpg,,,,,,,,,,,,,,,
"Holiday Card - Jolly Whatever (5-pack)","Somewhat non-denominational, postcard-style holiday card. Offset printed on 14lb cover stock in burnt red and blue with a small snowflake. Available in packs of five cards. Envelopes included.

If you would like to order a larger amount, or with envelopes, please contact me directly and I will create a listing for you.",10,USD,8,"postcard,card,holiday,christmas,hanukkah,winter,jolly,blue,red,snowflake","14lb cover stock",https://i.etsystatic.com/6311609/r/il/2cfe16/514906464/il_fullxfull.514906464_g3hy.jpg,https://i.etsystatic.com/6311609/r/il/713ead/514970299/il_fullxfull.514970299_dr0v.jpg,,,,,,,,,,,,,,,
"Simple Linoleum Print Poster - Minnesota Nice","9x9"" poster inspired by the Land of Lakes. 

Poster is hand cut single-process linoleum block print in black ink on 100 lb. Speckletone cover stock from French Paper Co. Each print is individually pressed by hand, numbered and signed, and will contain some unique imperfections.",12,USD,10,"Minnesota,Nice,Minnesota_Nice,State,Pride,Lakes,Linoleum_Print,Handprint,handcut,midwest,MN,typography,handlettered","100 lb cover stock,French Paper Co,Black Ink",https://i.etsystatic.com/6311609/r/il/3e0449/3156860484/il_fullxfull.3156860484_mhq2.jpg,https://i.etsystatic.com/6311609/r/il/27c1b1/3156860576/il_fullxfull.3156860576_j1hn.jpg,https://i.etsystatic.com/6311609/r/il/517710/3156860606/il_fullxfull.3156860606_7bfe.jpg,,,,,,,,,,,,,,
"Funny Silkscreen Special Edition - Sh*t Could Be Worse","Special edition Shit Could Be Worse 9x9"" poster inspired by the only advice my friend would give me on a bad day. 

Poster is hand cut dual-process silkscreen print in black and gold ink on 80 lb. Speckletone cover stock from French Paper Co. Each of the 50 prints is individually pulled by hand, numbered and signed, and will contain some unique imperfections.

Looks great at home or in the office, framed on unframed.",20,USD,17,"Funny,Poster,Minimalist,Simple,Sarcastic,Advice,Hand_Printed,Print,Linoleum_print,Typography,Mature,Shit_Could_Be_Worse,inspirational","black ink,cover stock,80 lb cover stock,gold ink,silkscreen",https://i.etsystatic.com/6311609/r/il/7e4413/472648871/il_fullxfull.472648871_hmbn.jpg,https://i.etsystatic.com/6311609/r/il/76241d/3204571325/il_fullxfull.3204571325_if1x.jpg,https://i.etsystatic.com/6311609/r/il/062939/3204571435/il_fullxfull.3204571435_2sqg.jpg,https://i.etsystatic.com/6311609/r/il/1e0bcc/3156862326/il_fullxfull.3156862326_a0xi.jpg,https://i.etsystatic.com/6311609/r/il/61b603/3204571567/il_fullxfull.3204571567_aq1w.jpg,,,,,,,,,,,,
